[
  {
    "id": "ECO-001",
    "type": "ecosystem",
    "name": "atlas-data",
    "owner": "mitre-atlas",
    "url": "https://github.com/mitre-atlas/atlas-data",
    "section": "knowledge",
    "evidence_class": "framework-data",
    "priority": "start-here",
    "status": "listed",
    "techniques": [],
    "summary": "Data for tactics, techniques and case studies of threats against AI systems.",
    "source_grade": "A",
    "provenance": "user-supplied research, cross-checked by shallow clone on 2026-10-07; last commit and license read from the repository; archive flag not visible to git",
    "added": "2026-10-07",
    "verification": {
      "method": "git clone --depth 1",
      "checked": "2026-10-07",
      "reachable": true,
      "last_commit": "2026-09-10",
      "license": "Apache-2.0"
    }
  },
  {
    "id": "ECO-002",
    "type": "ecosystem",
    "name": "atlas-website",
    "owner": "mitre-atlas",
    "url": "https://github.com/mitre-atlas/atlas-website",
    "section": "knowledge",
    "evidence_class": "framework-data",
    "priority": "standard",
    "status": "listed",
    "techniques": [],
    "summary": "Implementation of the ATLAS knowledge portal.",
    "source_grade": "A",
    "provenance": "user-supplied research, cross-checked by shallow clone on 2026-10-07; last commit and license read from the repository; archive flag not visible to git",
    "added": "2026-10-07",
    "verification": {
      "method": "git clone --depth 1",
      "checked": "2026-10-07",
      "reachable": true,
      "last_commit": "2026-09-15",
      "license": "Apache-2.0"
    }
  },
  {
    "id": "ECO-003",
    "type": "ecosystem",
    "name": "www-project-top-10-for-large-language-model-applications",
    "owner": "OWASP",
    "url": "https://github.com/OWASP/www-project-top-10-for-large-language-model-applications",
    "section": "knowledge",
    "evidence_class": "framework-data",
    "priority": "standard",
    "status": "listed",
    "techniques": [],
    "summary": "Risk taxonomy and security guidance for LLM applications.",
    "source_grade": "A",
    "provenance": "user-supplied research, cross-checked by shallow clone on 2026-10-07; last commit and license read from the repository; archive flag not visible to git",
    "added": "2026-10-07",
    "verification": {
      "method": "git clone --depth 1",
      "checked": "2026-10-07",
      "reachable": true,
      "last_commit": "2026-08-05",
      "license": "CC"
    }
  },
  {
    "id": "ECO-004",
    "type": "ecosystem",
    "name": "www-project-ai-security-and-privacy-guide",
    "owner": "OWASP",
    "url": "https://github.com/OWASP/www-project-ai-security-and-privacy-guide",
    "section": "knowledge",
    "evidence_class": "framework-data",
    "priority": "standard",
    "status": "listed",
    "techniques": [],
    "summary": "Security and privacy references for AI systems.",
    "source_grade": "A",
    "provenance": "user-supplied research, cross-checked by shallow clone on 2026-10-07; last commit and license read from the repository; archive flag not visible to git",
    "added": "2026-10-07",
    "verification": {
      "method": "git clone --depth 1",
      "checked": "2026-10-07",
      "reachable": true,
      "last_commit": "2026-10-07",
      "license": "none-found"
    }
  },
  {
    "id": "ECO-005",
    "type": "ecosystem",
    "name": "plot4ai-library",
    "owner": "PLOT4ai",
    "url": "https://github.com/PLOT4ai/plot4ai-library",
    "section": "knowledge",
    "evidence_class": "framework-data",
    "priority": "start-here",
    "status": "listed",
    "techniques": [],
    "summary": "Threat library for AI threat modeling.",
    "source_grade": "D",
    "provenance": "user-supplied research, cross-checked by shallow clone on 2026-10-07; last commit and license read from the repository; archive flag not visible to git",
    "added": "2026-10-07",
    "verification": {
      "method": "git clone --depth 1",
      "checked": "2026-10-07",
      "reachable": true,
      "last_commit": "2025-06-20",
      "license": "CC"
    }
  },
  {
    "id": "ECO-006",
    "type": "ecosystem",
    "name": "arc_pi_taxonomy",
    "owner": "Arcanum-Sec",
    "url": "https://github.com/Arcanum-Sec/arc_pi_taxonomy",
    "section": "knowledge",
    "evidence_class": "framework-data",
    "priority": "start-here",
    "status": "listed",
    "techniques": [
      "LLMI-T001",
      "LLMI-T002",
      "LLMI-T003"
    ],
    "summary": "Taxonomy specialised in prompt injection.",
    "source_grade": "D",
    "provenance": "user-supplied research, cross-checked by shallow clone on 2026-10-07; last commit and license read from the repository; archive flag not visible to git",
    "added": "2026-10-07",
    "verification": {
      "method": "git clone --depth 1",
      "checked": "2026-10-07",
      "reachable": true,
      "last_commit": "2026-06-29",
      "license": "CC"
    }
  },
  {
    "id": "ECO-007",
    "type": "ecosystem",
    "name": "aiid",
    "owner": "responsible-ai-collaborative",
    "url": "https://github.com/responsible-ai-collaborative/aiid",
    "section": "knowledge",
    "evidence_class": "incident-data",
    "priority": "start-here",
    "status": "listed",
    "techniques": [],
    "summary": "AI Incident Database: incidents and harms involving AI, broader than cybersecurity.",
    "source_grade": "D",
    "provenance": "user-supplied research, cross-checked by shallow clone on 2026-10-07; last commit and license read from the repository; archive flag not visible to git",
    "added": "2026-10-07",
    "verification": {
      "method": "git clone --depth 1",
      "checked": "2026-10-07",
      "reachable": true,
      "last_commit": "2026-10-05",
      "license": "Apache-2.0"
    }
  },
  {
    "id": "ECO-008",
    "type": "ecosystem",
    "name": "agent-threat-rules",
    "owner": "Agent-Threat-Rule",
    "url": "https://github.com/Agent-Threat-Rule/agent-threat-rules",
    "section": "knowledge",
    "evidence_class": "detection-content",
    "priority": "start-here",
    "status": "listed",
    "techniques": [
      "LLMI-T001",
      "LLMI-T002",
      "LLMI-T004",
      "LLMI-T008",
      "LLMI-T009",
      "LLMI-T011",
      "LLMI-T018",
      "LLMI-T021"
    ],
    "summary": "Detection rules for agent threats, including injection, tools and MCP.",
    "source_grade": "D",
    "provenance": "user-supplied research, cross-checked by shallow clone on 2026-10-07; last commit and license read from the repository; archive flag not visible to git",
    "added": "2026-10-07",
    "verification": {
      "method": "git clone --depth 1",
      "checked": "2026-10-07",
      "reachable": true,
      "last_commit": "2026-10-07",
      "license": "MIT"
    }
  },
  {
    "id": "ECO-009",
    "type": "ecosystem",
    "name": "awesome-llm-security",
    "owner": "corca-ai",
    "url": "https://github.com/corca-ai/awesome-llm-security",
    "section": "catalog",
    "evidence_class": "curated-list",
    "priority": "standard",
    "status": "listed",
    "techniques": [],
    "summary": "Tools, papers and projects on LLM security.",
    "source_grade": "D",
    "provenance": "user-supplied research, cross-checked by shallow clone on 2026-10-07; last commit and license read from the repository; archive flag not visible to git",
    "added": "2026-10-07",
    "verification": {
      "method": "git clone --depth 1",
      "checked": "2026-10-07",
      "reachable": true,
      "last_commit": "2025-08-20",
      "license": "none-found"
    }
  },
  {
    "id": "ECO-010",
    "type": "ecosystem",
    "name": "awesome-prompt-injection",
    "owner": "Joe-B-Security",
    "url": "https://github.com/Joe-B-Security/awesome-prompt-injection",
    "section": "catalog",
    "evidence_class": "curated-list",
    "priority": "standard",
    "status": "listed",
    "techniques": [
      "LLMI-T001",
      "LLMI-T002"
    ],
    "summary": "Resources on prompt injection.",
    "source_grade": "D",
    "provenance": "user-supplied research, cross-checked by shallow clone on 2026-10-07; last commit and license read from the repository; archive flag not visible to git",
    "added": "2026-10-07",
    "verification": {
      "method": "git clone --depth 1",
      "checked": "2026-10-07",
      "reachable": true,
      "last_commit": "2026-09-11",
      "license": "CC"
    }
  },
  {
    "id": "ECO-011",
    "type": "ecosystem",
    "name": "prompt-injection-defenses",
    "owner": "tldrsec",
    "url": "https://github.com/tldrsec/prompt-injection-defenses",
    "section": "catalog",
    "evidence_class": "curated-list",
    "priority": "start-here",
    "status": "listed",
    "techniques": [
      "LLMI-T001",
      "LLMI-T002"
    ],
    "summary": "Practical and proposed defences against prompt injection.",
    "source_grade": "D",
    "provenance": "user-supplied research, cross-checked by shallow clone on 2026-10-07; last commit and license read from the repository; archive flag not visible to git",
    "added": "2026-10-07",
    "verification": {
      "method": "git clone --depth 1",
      "checked": "2026-10-07",
      "reachable": true,
      "last_commit": "2025-02-22",
      "license": "none-found"
    }
  },
  {
    "id": "ECO-012",
    "type": "ecosystem",
    "name": "Awesome-LLM-Red-Teaming",
    "owner": "user1342",
    "url": "https://github.com/user1342/Awesome-LLM-Red-Teaming",
    "section": "catalog",
    "evidence_class": "curated-list",
    "priority": "standard",
    "status": "listed",
    "techniques": [],
    "summary": "Training, tools and material for LLM red teaming.",
    "source_grade": "D",
    "provenance": "user-supplied research, cross-checked by shallow clone on 2026-10-07; last commit and license read from the repository; archive flag not visible to git",
    "added": "2026-10-07",
    "verification": {
      "method": "git clone --depth 1",
      "checked": "2026-10-07",
      "reachable": true,